<?xml version="1.0" encoding="UTF-8"?>
<xs:schema xmlns:xs="http://www.w3.org/2001/XMLSchema">
    <xs:element name="ventas">
        <xs:complexType>
            <xs:sequence>
                <xs:element name="cabecera">
                    <xs:complexType>
                        <xs:sequence>
                            <xs:element name="nombre" type="xs:string" />
                            <xs:element name="subtitulo" type="xs:string" />
                            <xs:element name="descripcion" type="xs:string" />
                            <xs:element name="fecha" type="xs:string" minOccurs="1" />
                        </xs:sequence>
                    </xs:complexType>
                </xs:element>
                <xs:element name="cuerpo">
                    <xs:complexType>
                        <xs:sequence>
                            <xs:element name="norte" minOccurs="1" maxOccurs="1">
                                <xs:complexType>
                                    <xs:sequence>
                                        <xs:element name="libros_vendidos" minOccurs="4"
                                            maxOccurs="4">
                                            <xs:complexType>
                                                <xs:attribute name="trimestre">
                                                    <xs:simpleType>
                                                        <xs:restriction base="xs:integer">
                                                            <xs:minInclusive value="1" />
                                                            <xs:maxInclusive value="4" />
                                                        </xs:restriction>
                                                    </xs:simpleType>
                                                </xs:attribute>
                                                <xs:attribute name="unidades" default="-1">
                                                    <xs:simpleType>
                                                        <xs:restriction base="xs:integer">
                                                            <xs:minInclusive value="-1" />
                                                        </xs:restriction>
                                                    </xs:simpleType>
                                                </xs:attribute>
                                            </xs:complexType>
                                        </xs:element>
                                    </xs:sequence>
                                </xs:complexType>
                            </xs:element>
                            <xs:element name="centro" minOccurs="1" maxOccurs="1">
                                <xs:complexType>
                                    <xs:sequence>
                                        <xs:element name="libros_vendidos" minOccurs="4"
                                            maxOccurs="4">
                                            <xs:complexType>
                                                <xs:attribute name="trimestre">
                                                    <xs:simpleType>
                                                        <xs:restriction base="xs:integer">
                                                            <xs:minInclusive value="1" />
                                                            <xs:maxInclusive value="4" />
                                                        </xs:restriction>
                                                    </xs:simpleType>
                                                </xs:attribute>
                                                <xs:attribute name="unidades" default="-1">
                                                    <xs:simpleType>
                                                        <xs:restriction base="xs:integer">
                                                            <xs:minInclusive value="-1" />
                                                        </xs:restriction>
                                                    </xs:simpleType>
                                                </xs:attribute>
                                            </xs:complexType>
                                        </xs:element>
                                    </xs:sequence>
                                </xs:complexType>
                            </xs:element>
                            <xs:element name="sur" minOccurs="1" maxOccurs="1">
                                <xs:complexType>
                                    <xs:sequence>
                                        <xs:element name="libros_vendidos" minOccurs="4"
                                            maxOccurs="4">
                                            <xs:complexType>
                                                <xs:attribute name="trimestre">
                                                    <xs:simpleType>
                                                        <xs:restriction base="xs:integer">
                                                            <xs:minInclusive value="1" />
                                                            <xs:maxInclusive value="4" />
                                                        </xs:restriction>
                                                    </xs:simpleType>
                                                </xs:attribute>
                                                <xs:attribute name="unidades" default="-1">
                                                    <xs:simpleType>
                                                        <xs:restriction base="xs:integer">
                                                            <xs:minInclusive value="-1" />
                                                        </xs:restriction>
                                                    </xs:simpleType>
                                                </xs:attribute>
                                            </xs:complexType>
                                        </xs:element>
                                    </xs:sequence>
                                </xs:complexType>
                            </xs:element>
                        </xs:sequence>
                    </xs:complexType>
                </xs:element>
            </xs:sequence>
        </xs:complexType>
    </xs:element>
</xs:schema>